{
  "type": "game.save.v1",
  "request_id": "request-save-001",
  "expected_revision": 42,
  "state": {
    "schema_version": 1,
    "content_version": "heroes_trial_school_v1",
    "missions": {
      "when_play_stops_being_play": { "status": "active", "stage_id": "find_witness", "checkpoints": {}, "data": {} },
      "lia_memory": { "status": "complete", "stage_id": "complete", "checkpoints": {}, "data": {} },
      "pingpong_soccer": { "status": "available", "stage_id": "cutscene", "checkpoints": {}, "data": {} },
      "respect_also_cares": { "status": "active", "stage_id": "comfort_activity", "checkpoints": {}, "data": {} }
    },
    "progression": { "coins": 12, "stars": 1, "challenges": { "lia_memory": true }, "rewards": { "challenge:lia_memory": true } }
  }
}
